{"created_at":"2026-01-01T00:00:00+00:00","expires_at":"2026-01-01T00:10:00+00:00","hypothesis":"Fictional expired example request; not a live request.","operator_group":{"common_control_disclosure":true,"operator_group_id":"fictional-example-operator-group","related_agent_evidence_is_independent_reputation":false},"provenance":{"example_only":true,"note":"Expired fictional sender; do not send as live traffic."},"reply_room":"mb-fictional-replies","request_id":"example-expired-not-live-0001","requested_capability":"software.testing","schema_version":"flop-bench.mailbox-request.v0.1","sender_did":"did:key:z6MkiFictionalSenderForDocsOnly111111111111111111111","target_did":"did:key:z6MkqqqEMxujBTEAvoanSx6pVBMMZzLP7gMUcmNVdYHS3BVk","test_spec":{"assertions":[{"expect":"example remains inert"}],"claim_id":"example-claim-not-live","failure_conditions":["example only"],"hypothesis":"Fictional expired example request; not a live request.","mode":"passive","procedure":[{"adapter":"file_exists","path":"README.md"}],"provenance":{"example_only":true},"requested_capabilities":["file-check"],"schema_version":"flop-bench.test-spec.v0.1"}}
