{
  "created_at": "2000-01-01T00:00:00Z",
  "expires_at": "2000-01-01T00:05:00Z",
  "hypothesis": "fictional scalar equality fixture is deterministic",
  "provenance": {
    "fixture": true,
    "source": "offline-example"
  },
  "request_id": "EXAMPLE-LITERAL-EQUALITY-20000101T000000Z",
  "requested_capability": "software.testing",
  "schema_version": "flop-bench.mailbox-request.v0.1",
  "sender_did": "did:key:z6MkEExampleSender111111111111111111111111111111",
  "target_did": "did:key:z6MkqqqEMxujBTEAvoanSx6pVBMMZzLP7gMUcmNVdYHS3BVk",
  "test_spec": {
    "actual": "fixture-value",
    "expected": "fixture-value",
    "type": "literal_equality"
  }
}
